{
    "uuid": "a5563b66-dfa1-4f69-a9d8-18a6ae1f6d7e",
    "title": "In browser file editor input with pl-file-editor",
    "topic": "Test",
    "tags": ["balamut2", "code", "v3"],
    "type": "v3",
    "singleVariant": true,
    "gradingMethod": "External",
    "externalGradingOptions": {
        "enabled": true,
        "image": "prairielearn/grader-python",
        "serverFilesCourse": ["python_autograder/"],
        "entrypoint": "/grade/serverFilesCourse/python_autograder/run.sh",
        "timeout": 20
    }
}
