{
            "uuid": "20899642-341f-3bd9-9f22-4546f1efbfe8",
            "title": "Switched LC Circuit",
            "topic": "Inductance",
            "tags": [
                "license:CC-BY-NC",
                "author:jake.bobowski@ubc.ca",
                "calculation"
              ],
              "type": "v3"
        }