{
    "uuid": "6e2f0457-5809-4f44-bc25-243f742e09c9",
    "title": "Autograder demo: Draw a triangle in C",
    "topic": "Autograder",
    "tags": [
        "code", "jonatan", "muchen", "c"
    ],
    "type": "v3",
    "singleVariant": true,
    "gradingMethod": "External",
    "externalGradingOptions": {
        "enabled": true,
        "image": "prairielearn/grader-c",
        "timeout": 100,
        "entrypoint": "python3 /grade/tests/test.py"
    }
}
